{
  "$schema": "../../docs/schemas/preset.schema.json",
  "schemaVersion": 1,
  "id": "all-candlepin",
  "name": "All Candlepin",
  "description": "Use Candlepin on every line.",
  "globalDefaults": {
    "backingMm": 2.2,
    "weldExportedDesign": true
  },
  "lineDefaults": {
    "fontId": "candlepin",
    "bridgeMm": 0.5,
    "lineBridgeMm": 0.5,
    "offsetXMm": 0,
    "fontSizeMm": 34,
    "horizontalScale": 1,
    "verticalScale": 1,
    "lockTextHeight": false
  },
  "lineRules": [
    {
      "match": {
        "kind": "all"
      },
      "settings": {
        "fontId": "candlepin"
      }
    }
  ]
}
